Book Name,Author,Rating,Number of Reviews,Price,Listening Time (Minutes),Rank,Genre,Processed_Description,cluster
Stop Smoking with Allen Carr: Plus a Unique 70 Minute Seminar Delivered by the Author,Allen Carr,4.0,16.5,569.0,342.0,3,Personal Development & Self-Help,"Ideal listening car whilst traveling , new updated version globally best-selling book , The Easy Way Stop Smoking , also includes unique 70 minute seminar delivered author .",0
How to Enjoy Your Life and Your Job,Dale Carnegie,4.3,306.0,668.0,333.0,1,Personal Development & Self-Help,"Even love work , probably day almost nothing go right . Best-selling author Dale Carnegie show make every day exciting rewarding - get done fun .",1
Words That Change Minds: The 14 Patterns for Mastering the Language of Influence,Shelle Rose Charvet,4.4,564.0,668.0,598.0,2,Analysis & Strategy,"Learn master influential language get want , without manipulating .",1
"67 Hot Explicit Erotic Sex Stories: Swingers, BDSM, Spanking, Bisexual, Paranormal Threesomes, BBW Erotica, Lesbian First Time, Medical, Gangbangs and Much More...",Ashley Winters,4.0,5.0,1003.0,1368.0,741,Erotic Fiction,"In hot enticing multi-author multi-narrator mega collection filled 67 filthy erotic story , ’ experience swinger , werewolf , BDSM , spanking , vampire , bisexual , -- l , paranormal threesome , big beautiful woman erotica , lesbian first time , medical , gangbangs much , much more… .",0
"Lead with a Story: A Guide to Crafting Business Narratives That Captivate, Convince, and Inspire",Paul Smith,4.3,170.0,836.0,651.0,1,Organisational Behaviour,"Storytelling come age business world . Today , many successful company use storytelling leadership tool . At Nike , senior executive designated `` corporate storyteller '' . 3M banned bullet point year ago replaced process writing `` strategic narrative '' . Procter & Gamble hired Hollywood director teach executive storytelling technique . Some forward-thinking business school even added storytelling course management curriculum . The reason simple : Stories ability engage audience way logic bullet point alone never could . Whether trying communicate vision , sell idea , inspire commitment , storytelling powerful business tool mean difference mediocre result phenomenal success .",1
Power vs. Force: The Hidden Determinants of Human Behavior,Dr. David R. Hawkins,4.6,298.0,1148.0,490.0,1,Textbooks & Study Guides,"Analyzing basic nature human thought consciousness , author make available everyone key penetrating last barrier advancement civilization science resolving crucial human dilemma : instantly determine truth falsehood statement supposed fact .",1
The Warmth of Other Suns: The Epic Story of America's Great Migration,Isabel Wilkerson,4.8,3479.5,1338.0,1360.0,1,African American Demographic Studies,"National Book Critics Circle Award , Nonfiction , 2011",0
The Leadership Sutra: An Indian Approach to Power,Devdutt Pattanaik,4.5,38.0,233.0,159.0,2,Leadership,"Durga goddess power Hinduism well Buddhism Jainism . Her name derived word fortress ( durg ) . She goddess king . She ride lion , king jungle symbol royalty everywhere , China England .",1
SPQR: A History of Ancient Rome,Mary Beard,4.4,1960.5,569.0,1110.0,2,Textbooks & Study Guides,"Ancient Rome matter . Its history empire , conquest , cruelty excess something still judge . Its myth story - Romulus Remus rape Lucretia - still strike chord u . And debate citizenship , security right individual still influence debate civil liberty today .",1
"Eat, Pray, Love: One Woman's Search for Everything Across Italy, India and Indonesia",Elizabeth Gilbert,4.3,3130.5,937.0,770.0,1,g & Commentary,"It 's 3 a.m. , Elizabeth Gilbert sobbing bathroom floor . She 's 30 , husband , house , 're trying baby - n't want . A bitter divorce turbulent love affair later , emerges battered bewildered , realises time pursue journey search three thing missing : pleasure , devotion , balance .",1
Tatalog,Harish Bhat,3.8,12.0,1005.0,352.0,784,Analysis & Strategy,"Tatalog present eight riveting hitherto untold story strategic operational challenge Tata company faced past two decade forward thinking determination raised brand new height . From Tata Indica , first completely Indian car ; jewelry brand Tanishq ; Tata Finance , survived several tribulation , Tatalog , written Tata insider , reveals DNA every Tata enterprise - combination pioneering , purposive , principled , `` perfect '' .",0
Creative Visualization,Shakti Gawain,4.6,381.5,398.0,180.0,828,Personal Success,"By completing purchase agree Audible ’ Conditions Use , Amazon 's Privacy Notice applicable Audible 's Recurring Payment Terms .",4
The Harbinger II: The Return,Jonathan Cahn,4.8,303.0,586.0,614.0,1,Religious & Spiritual Fiction,Are unprecedented crisis time sign warning coming judgment ? Does ancient mystery hold secret event time future America world ? Is mystery even behind shaking overtaken world America ? How much time left ?,1
One Small Step Can Change Your Life: The Kaizen Way to Success,Dr. Robert Maurer,4.6,670.0,1774.0,437.0,890,Analysis & Strategy,The kaizen way change life .,1
Close to the Bone,Lisa Ray,4.5,102.5,1003.0,950.0,1,Biographies & Autobiographies (Books),`` A thrilling journey inwards much outwards .... A must-read . '' ( Freida Pinto ),1
The Witches,Roald Dahl,4.8,12.0,615.0,268.0,359,Children's Literature & Fiction (Books),Brought Penguin .,2
HBR Guide to Better Business Writing,Harvard Business Review,4.45,333.0,501.0,240.0,1,ess Careers,Do n't let writing hold back .,1
"Dark Psychology and Manipulation: For a Better Life: The Ultimate Guide to Learning the Art of Persuasion, Emotional Influence, NLP Secrets, Hypnosis, Body Language, and Mind Control Techniques",Brandon Goleman,4.1,72.0,501.0,205.0,1,Personal Development & Self-Help,"If want know deeply , 're going deepen emotional intelligence live happy fulfilled life , keep reading ...",1
"Goodbye Parkinson’s, Hello Life!: The Gyro-Kinetic Method for Eliminating Symptoms and Reclaiming Your Good Health",Alex Kerten,4.2,115.0,469.0,228.0,141,"d, Body & Spirit","Parkinson ’ disease , disorder central nervous system , affect 1 million people America 10 million worldwide . In Goodbye Parkinson ’ , Hello Life ! Alex Kerten present breakthrough holistic technique combine dance therapy , behavior modification , martial art prove life beyond diagnosis PD .",1
Gardens of the Moon: The Malazan Book of the Fallen 1,Ralph Lister,4.1,1406.5,1093.0,1562.0,2,Contemporary Fiction (Books),"Random House present audiobook edition Gardens Moon : The Malazan Book Fallen 1 Steven Erikson , read Ralph Lister .",3
Olympus: An Indian Retelling of the Greek Myths,Devdutt Pattanaik,4.3,167.0,879.0,503.0,626,"Myths, Legends & Sagas","Is connection Greek Hindu mythology ? Does something common Indo-European root ? Or maybe exchange idea century followed arrival Alexander Great , Greek emissary travelled kingdom Mathura Magadha ?",1
Forgiveness & Loving the Inner Child,Louise L. Hay,4.4,67.0,257.0,29.0,2,Personal Development & Self-Help,"By completing purchase agree Audible ’ Conditions Use , Amazon 's Privacy Notice applicable Audible 's Recurring Payment Terms .",4
Fifty Shades Darker: Book Two of the Fifty Shades Trilogy,E. L. James,4.3,20816.5,1093.0,1189.0,2,Contemporary Fiction (Books),"For loved Fifty Shades Grey , second instalment le enthralled . Immerse E.L. James ' sinfully debauched world .",1
Ashadh ka Ek Din [Free One Day],Mohan Rakesh,-1.0,267.25,501.0,211.0,2,Plays,This Hindi play Mohan Rakesh debuted 1958 considered first modern Hindi play . The play received Sangeet Natak Akademi Award best play 1959 .,0
"Ask and It Is Given, Volume 1: The Law of Attraction",Jerry Hicks,-1.0,267.25,562.0,212.0,2,Personal Development & Self-Help,"As listen , 'll come understand Universal law govern time/space reality influence relationship , health issue , finance , career concern , . It 's birthright live life filled everything good , audio program show make every way !",1
"Stealing Fire: How Silicon Valley, the Navy SEALs, and Maverick Scientists Are Revolutionizing the Way We Live and Work",Steven Kotler,4.4,502.0,11862.0,504.0,1,Technology & Society,"The author best-selling Bold The Rise Superman explore altered state consciousness ignite passion , fuel creativity , accelerate problem solving , groundbreaking book vein Daniel Pink 's Drive Charles Duhigg 's Smarter Faster Better .",0
Conscious Business,Fred Kofman,-1.0,267.25,1406.0,581.0,2,ess Management,"In Conscious Business , 'll join visionary teacher founder Leading Learning Communities master skill .",1
The Last Juror,John Grisham,4.5,951.5,410.0,355.0,2,Suspense,"The murderer , Danny Padgitt , tried packed courtroom Clanton , Mississippi . The trial came startling dramatic end defendant threatened revenge juror convicted . Nevertheless , found guilty , sentenced life prison . But Mississippi 1970 , 'life ' n't necessarily mean 'life ' , nine year later Danny Padgitt managed get paroled . He returned Ford County , retribution began .",1
Tiny Beautiful Things: Advice on Love and Life from Dear Sugar,Cheryl Strayed,4.7,1833.0,569.0,581.0,2,Family & Relationships,"Life hard : lover cheat ; lose family member ; ’ pay bill . And great : ’ hottest sex life ; get plum job ; muster courage write novel . Sugar - once-anonymous online columnist The Rumpus , revealed Cheryl Strayed , author best-selling memoir Wild - person thousand turn advice . Tiny Beautiful Things gather best `` Dear Sugar '' one place includes never-before-published column new introduction Steve Almond . Rich humor , insight , compassion - absolute honesty - book balm everything life throw way .",0
Honoring the Self: The Pyschology of Confidence and Respect,Nathaniel Branden PhD,4.4,130.5,1774.0,424.0,2,"d, Body & Spirit","`` Tell person judge self-esteem '' , say pioneering psychologist Nathaniel Branden , `` I tell person operates work , love , sex , parenting , every important aspect existence - high likely rise . The reputation - self-esteem - single important factor fulfilling life . ''",1
Jeeves in the Offing,Ian Carmichael,4.6,63.5,467.0,288.0,2,Humour (Books),"Jeeves holiday Herne Bay , 's away world cave Bertie Wooster . For start , 's astonished read The Times engagement mercurial Bobbie Wickham . Then Brinkley Court , Aunt Dahlia 's establishment , find awful former head master attendance ready award prize Market Snodsbury Grammar School . And finally Brinkley butler turn reason Bertie 's nemesis disguise , brain surgeon Sir Roderick Glossop .",0
"The Spy Chronicles: RAW, ISI and the Illusion of Peace",A.S Dulat,3.9,275.0,668.0,513.0,2,Textbooks & Study Guides,"Sometime 2016 , series dialogue took place set find meeting ground , even illusion , A.S. Dulat Asad Durrani . One former chief RAW , India 's external intelligence agency , ISI , Pakistani counterpart . As could meet home country , conversation , guided journalist Aditya Sinha , took place city like Istanbul , Bangkok Kathmandu .",1
Bol Bachchan [Speak Bachchan],Rupesh Dubey,5.0,5.0,668.0,328.0,2,Biographies & Autobiographies (Books),"Author Rupesh Dubey delf life Indian cinema superstar Amitabh Bachchan compelling compilation incident journey cinema , dialogue film lesson life . An inspiring motivating audiobook , draw success mantra life work actor . Describing self-help book , author go back early struggle Bachchan , connecting deepest aspiration . What success , happiness precede follow success ? He reflects question digging deeper trial tribulation Bachchan ’ rise fame . In conversational style , writer cite example everyday life invite listener think , sharing thought wisdom friend . He point Indian cinema , film star cast easily land producer , distributor date theatrical release even draw advance booking . Similarly , happiness superstar , say . Through audiobook , explains take control destiny producer , director star life . Bachchan ’ life provides insight one persevere hope , despair , challenge opportunity . What learn personal journey larger-than-life image screen ?",1
The Shock Doctrine: The Rise of Disaster Capitalism,Naomi Klein,4.7,1041.0,888.0,1337.0,2,Free Enterprise,"Penguin present audiobook edition The Shock Doctrine Naomi Klein , read Katherine Fenton .",3
Braving the Wilderness: The Quest for True Belonging and the Courage to Stand Alone,Brené Brown,4.7,2599.0,615.0,252.0,2,Personal Development & Self-Help,"Random House present audiobook edition Braving Wilderness , written read Brené Brown .",3
Ramayana,Ram Dass,1.9,2.0,562.0,267.0,1,Christianity (Books),"By completing purchase agree Audible ’ Conditions Use , Amazon 's Privacy Notice applicable Audible 's Recurring Payment Terms .",4
The Organized Mind: Thinking Straight in the Age of Information Overload,Daniel Levitin,4.3,583.0,1025.0,969.0,2,Earth Sciences Books,Not Available,1
Entrepreneur 5 P.M. to 9 A.M.: Launching a Profitable Start-Up Without Quitting Your Job,Kanth Miriyala,4.0,125.0,501.0,181.0,2,ess Management,You job idea business . What ?,1
Kashmirnama (Hindi Edition),Ashok Kumar Pandey,4.5,173.0,1171.0,1280.0,1,Asian History (Books),Ashok Kumar Pandey well-known Hindi poet writer . His recent book Kashmirnama praised reputed historian well general audience .,1
The Power is Within You,Louise L. Hay,4.7,742.0,703.0,430.0,969,Personal Success,"By completing purchase agree Audible ’ Conditions Use , Amazon 's Privacy Notice applicable Audible 's Recurring Payment Terms .",4
A Room of One's Own: Penguin Classics,Virginia Woolf,4.4,634.0,615.0,257.0,1,Society & Culture (Books),Brought Penguin .,2
Meditations,Marcus Aurelius,4.3,6590.5,99.0,407.0,1,Textbooks & Study Guides,"Written Greek , without intention publication , Roman emperor also philosopher , Meditations Marcus Aurelius ( AD 121-180 ) offer remarkable series challenging spiritual reflection exercise developed emperor struggled understand make sense universe .",1
The Lonely City: Adventures in the Art of Being Alone,Olivia Laing,4.3,276.5,569.0,493.0,3,Biographies & Autobiographies (Books),What mean lonely ? How live 're intimately engaged another human ? How connect people ?,1
Beyond Mars and Venus: Relationship Skills for Today's Complex World,John Gray,4.6,144.0,668.0,584.0,2,Love & Romance,"For 20 year , John Gray 's Men Are Mars , Women Are Venus helped couple deepen intimacy rejuvenate love life . Men woman , revealed , communicate differently , might well different planet . By learning speak 's language , million people dramatically improved , even saved relationship .",1
Amnesty,Aravind Adiga,4.1,34.5,645.0,513.0,3,Literary Fiction,"A riveting , suspenseful exuberant novel best-selling , Booker Prize-winning author The White Tiger young illegal immigrant must decide whether report crucial information murder - risk deportation .",0
After,Anna Todd,4.2,353.0,497.0,941.0,2,Romance (Books),"Ambiziosa , riservata e con un ragazzo perfetto che l'aspetta casa , Tessa ama pensare di avere il controllo della sua vita . Al primo anno di college , il suo futuro sembra già segnato : una laurea , un buon lavoro , un matrimonio felice ... Sembra , perché Tessa fa malapena tempo mettere piede nel campus che subito s'imbatte Hardin . E da allora niente è più come prima .",1
Dare to Lead,Brené Brown,4.7,3414.5,888.0,490.0,446,Analysis & Strategy,Brought Penguin .,2
"The Unavailable Father: Seven Ways Women Can Understand, Heal, and Cope with a Broken Father-Daughter Relationship",Sarah S. Rosenthal,3.4,22.0,603.0,364.0,2,Personal Success,Strategies overcoming damaged father/daughter relationship,1
The Grand Design,Stephen Hawking,4.5,1431.0,615.0,272.0,218,Textbooks & Study Guides,"In last 30 year life , Albert Einstein searched unified theory - theory could describe force nature single framework . But time right discovery Einstein 's day .",1
Comparative Literature: A Very Short Introduction,Ben Hutchinson,4.9,12.0,501.0,296.0,3,"Literary Theory, History & Criticism","From colonial empire-building 19th century postcolonial culture war 21st century , attempt `` comparison '' defined international agenda literature . But comparative literature ? Ambitious reader looking stretch usually intrigued concept uncertain implication . And rightly , many way : Even professional agree single term , calling comparative English , compared French , comparing German . The term , approached comparatively , open Pandora 's box cultural difference .",1
The Secret to Attracting Money,Joe Vitale,4.1,18.0,1439.0,368.0,3,"d, Body & Spirit","Attract money prosperity ease , using awesome power Law Attraction !",1
The 1% Rule: How to Fall in Love with the Process and Achieve Your Wildest Dreams,Tommy Baker,4.45,333.0,501.0,262.0,2,Personal Development & Self-Help,"In highlight-reel , microwave world - ’ led believe success right around corner . It ’ working .",1
Lead the Field,Earl Nightingale,4.7,58.0,1003.0,243.0,2,Textbooks & Study Guides,Profit `` Program Presidents '' Lead Field .,1
The Haunting of Hill House,Shirley Jackson,4.3,2566.5,585.0,447.0,2,Horror (Books),"Past rusted gate untrimmed hedge , Hill House brood waits… .",1
Candide,Voltaire,4.3,861.0,32.0,257.0,2,Literary Fiction,"`` Candide '' delightful story filled boundless misadventure tackling great philosophical issue Enlightenment era . The story Candide , young man illegitimate nephew German baron resides . When discovered kissing baron 's beautiful daughter thrown castle experience horror war , poverty , maliciousness man , hypocrisy church .",0
"The Magician: The Secrets of the Immortal Nicholas Flamel, Book 2",Michael Scott,4.7,561.0,1105.0,658.0,1,Children's Action & Adventure,Nicholas Flamel appeared J.K. Rowling ’ Harry Potter - know really lived ? And secret n't safe ! Discover truth book two New York Times best-selling series Secrets Immortal Nicholas Flamel .,0
The Seven Basic Plots: Why We Tell Stories,Christopher Booker,4.3,192.0,1172.0,2338.0,2,Society & Culture (Books),"This remarkable monumental book last provides comprehensive answer age-old riddle whether small number `` basic story '' world . Using wealth example , ancient myth folk tale via play novel great literature popular movie TV soap opera today , reveals seven archetypal theme recur throughout every kind storytelling .",0
Esther Perel: Audible Sessions: FREE Exclusive Interview,Holly Newson,-1.0,267.25,0.0,14.0,65,Biographies of Authors,Joining u Audible Studios discus series Where Should We Begin ? esteemed psychotherapist Esther Perel .,1
Mind Without Fear,Rajat Gupta,4.5,154.0,836.0,668.0,2,Biographies & Autobiographies (Books),"For nine year , Rajat Gupta led McKinsey & Co. - first foreign-born person head world ’ influential management consultancy . He also driving force behind major initiative Indian School Business Public Health Foundation India . A globally respected figure , sat board distinguished philanthropic institution Gates Foundation Global Fund Fight AIDS , Tuberculosis Malaria , corporation including Goldman Sachs , American Airlines , Procter & Gamble .",1
"Dog Days: Diary of a Wimpy Kid, Book 4",Jeff Kinney,4.5,2666.5,410.0,148.0,990,Children's Literature & Fiction (Books),Brought Puffin .,2
The Long Walk: The True Story of a Trek to Freedom,Slavomir Rawicz,4.6,1180.0,670.0,574.0,2,United States History (Books),"With map compass ax head , homemade knife , week 's supply food , compatriot spent year making way foot British India , 4,000 mile forbidding terrain earth . They braved Himalayas , desolate Siberian tundra , icy river , great Gobi Desert , always hair 's breadth death . Finally arriving , Rawicz reenlisted Polish army fight Germans .",1
The 12 Week Year: Get More Done in 12 Weeks Than Others Do in 12 Months,Brian P. Moran,4.7,1120.5,656.0,317.0,2,Textbooks & Study Guides,The guide shortening execution cycle one year 12 week,0
The Facebook Effect: The Inside Story of the Company That Is Connecting the World,David Kirkpatrick,4.4,145.0,836.0,938.0,2,E-Commerce,"In little half decade , Facebook gone dorm-room novelty company 500 million user - essential part social life teenager hundred million adult worldwide . As Facebook spread around globe , creates surprising effect - even becoming instrumental political protest .",1
The Deep Learning Revolution,Terrence J. Sejnowski,4.1,29.0,586.0,485.0,1,Computer Science Books,How deep learning - Google Translate driverless car personal cognitive assistant - changing life transforming every sector economy .,1
Transcend: The New Science of Self-Actualization,Scott Barry Kaufman,4.7,74.0,1005.0,614.0,2,Personal Development & Self-Help,"A bold reimagining Maslow 's famous hierarchy need - new insight realizing full potential living creative , fulfilled , connected life .",1
Renewal: A Little Book of Courage & Hope,Eknath Easwaran,4.5,2.0,163.0,83.0,2,Spirituality (Books),"This collection short reading includes story East West , inspiration Gandhi world 's saint , spiritual insight practical idea adopt today , matter faith , philosophy , lifestyle .",1
Who Says Elephants Can't Dance?: Inside IBM's Historic Turnaround,Louis V. Gerstner Jr.,4.4,218.0,10873.0,509.0,2,Computers & Internet,"Enter Lou Gerstner . The presumption Gerstner joined IBM preside continued dissolution confederation autonomous business unit , effectively eliminating corporation invented many industry 's important technology . Instead , Gerstner took hold company , making bold decision keep together , defiantly announcing , `` The last thing IBM need right vision . ''",1
You Are the Best Friend ,Ajay K Pandey,4.6,1252.5,668.0,329.0,2,Anthologies (Books),Is happy ending Ajay time around ?,1
What to Expect the First Year,Heidi Murkoff,4.7,2952.0,1673.0,2207.0,409,Family & Relationships,"Some thing baby , happily , never change . They still arrive warm , cuddly , soft , smelling impossibly sweet . But mom dad care brand new bundle baby joy changed—and , world ’ best-selling , best-loved guide instruction baby ’ come with…but totally . In audio , Audible , first time ever , What Expect First Year brought life engaging , comforting narration author Heidi Murkoff . Accompanied full cast audio talent , Heidi enlivens empathetic , reality-based advice , practical tip , reassuring support make First Year definitive , must-have baby bible . Best , ’ anywhere , anytime—talking ( cheering ) long night sometimes longer day , cry jag , gas , blowout diaper , nap strike , breastfeeding struggle , stuffy nose , teething , much .",0
"Mental Toughness: Train Your Brain: Imрrоvе Fосuѕ, Brаin Ѕесrеtѕ, Реаk Реrfоrmаnсе, Hоw Сhаmрiоnѕ Think, Сritiсаl Thinking, Ѕеlf-Соnfidеnсе, Роwеrful Hаbitѕ, Mеntаl Rеѕiliеnсе Likе a Sраrtаn",G. S. Baker,4.05,16.5,501.0,184.0,3,Analysis & Strategy,"If choose right decision every single day life without getting stress anxiety goal becoming strong person , keep reading .",1
The Seed of Compassion: Lessons from the Life and Teachings of His Holiness the Dalai Lama,His Holiness Dalai Lama,4.5,23.5,410.0,14.0,3,"Children's Family, Personal & Social Issues (Books)",Brought Puffin .,2
7 Secrets of the Goddess: The Hindu Trinity Series,Devdutt Pattanaik,4.4,111.0,501.0,278.0,2,Christianity (Books),Lakshmi massage Vishnu 's foot . Is male domination ?,1
The Beekeeper of Aleppo: A Moving Testament to the Human Spirit,Christy Lefteri,4.6,2071.5,1025.0,517.0,1,Contemporary Fiction (Books),Shortlisted Audiobook Year - The British Book Awards 2020,0
"Good Morning, Good Life: 5 Simple Habits to Master Your Mornings and Upgrade Your Life",Amy Schmittauer Landino,4.7,177.0,668.0,300.0,2,Personal Development & Self-Help,Not morning person ? Not problem ! I want wake term one else 's .,1
The 5 Levels of Leadership: Proven Steps to Maximize Your Potential,John C. Maxwell,4.8,775.0,500.0,433.0,2,ess,"Fuel success grow team every level leadership . True leadership n't matter certain job title . In fact , chosen position first five level every effective leader achieves . To become `` bos '' people follow required , master ability invest people inspire . To grow role , must achieve result build team produce .",1
Secrets of the Millionaire Mind in Turbulent Times,T. Harv Eker,-1.0,267.25,1774.0,493.0,2,Personal Development & Self-Help,Now economy ALWAYS booming !,1
Cinderella,Charles Perrault,-1.0,267.25,151.0,50.0,2,"Myths, Legends & Sagas","In classic child 's tale triumph adversity , Cinderella condemned life servitude uncaring stepmother constant torment jealous stepsister . Throughout suffering , Cinderella maintains kindness , one day rewarded meeting true love - handsome Prince .",1
The Outward Mindset: Seeing Beyond Ourselves,The Arbinger Institute,4.7,320.5,501.0,262.0,2,Leadership,"The Arbinger Institute helped million book Leadership Self-Deception The Anatomy Peace . Their newest book , The Outward Mindset , reflects latest research experience offer new intuitive way teach people implement mindset change scale across organization , incredible effect .",0
Originals: How Non-Conformists Change the World,Adam Grant,4.5,1346.0,888.0,601.0,622,Leadership,"The New York Times best-selling author examines people drive creative , moral organisational progress - leader encourage originality organisation .",0
"Why Zebras Don't Get Ulcers: The Acclaimed Guide to Stress, Stress-Related Diseases, and Coping - Now Revised and Updated",Robert M. Sapolsky,4.6,776.5,1289.0,1036.0,2,Personal Development & Self-Help,"Now third edition , Robert M. Sapolsky 's acclaimed successful Why Zebras Do n't Get Ulcers feature new chapter stress affect sleep addiction , well new insight anxiety personality disorder impact spirituality managing stress .",1
