Book Name,Author,Rating,Number of Reviews,Price,Listening Time (Minutes),Rank,Genre,Processed_Description,cluster
Wonder,R J Palacio,4.7,17001.5,888.0,485.0,3,Children's Literature & Fiction (Books),"Soon major film starring Julia Roberts , Owen Wilson Jacob Tremblay .",1
The Color Purple,Alice Walker,4.6,2320.5,668.0,478.0,1,Literary Fiction,"Winner Pulitzer Prize National Book Award , novel resilient courageous woman become Broadway show cultural phenomenon .",0
The IndiGo Story: Inside the Upstart that Redefined Indian Aviation,Shelley Vishwajeet,4.1,50.5,668.0,371.0,1,Analysis & Strategy,"The IndiGo Story fascinating analysis manner unknown entity entered perilous Indian sky became undisputed leader term market share profitability . Lucidly written sharply argued , book highlight company ’ formative year fearless start-up evolution one India ’ game-changing , profitable brand .",0
Sahaj Yog,OSHO,4.5,2.0,670.0,2230.0,371,Personal Development & Self-Help,"Siddhon ka ek mahaan sandesh , 'Jaago ' , Osho ki vaani dwara pravachanon mein aur bhi adhik mukharit hua hai . Osho kehte hain : 'Jaago , man jaagran ki bela ! Aur jaagran ki bela hamesha hai . Aisa koi khsan nahi jab tum jaag na sako . Aisa koi pal nahi jab tum palak na khol sako . Aankh band kiye ho yah tumhaara nirnay hai . Aankh kholna chaho isi khsan kraanti ghat sakti hai .",1
The Real Book of Real Estate: Real Experts. Real Stories. Real Life.,Robert T. Kiyosaki,4.5,223.5,586.0,1073.0,1,ess Careers,"In world many financial advisor follow advice , book written expert practice teach teach thrive , merely survive , turbulent economic time . This real deal ... The Real Book Real Estate .",0
An Unsuitable Boy,Karan Johar,3.9,868.0,1256.0,519.0,977,ema & Broadcast (Books),"Karan Johar synonymous success , panache , quick wit , outspokenness , sometimes inadvertently creates controversy make headline . KJo , popularly called , much-loved Bollywood film director , producer , actor , discoverer new talent . With flagship Dharma Production , constantly challenged norm , written rewritten rule , set trend .",1
Khullam Khulla: Rishi Kapoor Uncensored,Rishi Kapoor,4.0,435.5,669.0,474.0,389,Biographies & Autobiographies (Books),"Few actor Hindi cinema Rishi Kapoor 's sort career arc : gawky adolescent pining schoolteacher ( Mera Naam Joker , 1970 ) naughty 90-year-old ( Kapoor & Sons , 2016 ) , Rishi Kapoor regaled audience close 50 year . He National Award debut , became overnight sensation first film leading man ( Bobby , 1973 ) , carved niche string romantic musical blockbuster era known angst-ridden film . He youth icon still toast satellite TV circuit . The song lip-synced bread butter radio station even today . Then second coming brief hiatus 1990s - one finest actor mainstream Hindi cinema powerhouse performance film like Do Dooni Chaar , D-Day , Agneepath others .",1
Share Market Guide (Hindi Edition),Sudha Shrimali,3.6,200.0,836.0,638.0,353,Textbooks & Study Guides,"There several book topic stock market , however audiobook unique author tried explain complex aspect financial sector clear simplified manner . All aspect share market , including commodity market mutual fund , explained simple term .",1
Self Leadership and the One Minute Manager: Gain the Mindset and Skillset for Getting What You Need to Succeed,Ken Blanchard,4.7,83.5,4700.0,159.0,681,Personal Success,"Twenty year creating phenomenal best-selling classic The One Minute Manager , Ken Blanchard return root powerful essential title series explores skill needed empower success .",0
The Holy Bible in Audio - King James Version: The Complete Old & New Testament,King James Version,4.4,993.5,1055.0,4321.0,783,Textbooks & Study Guides,"The King James Version continued day one beloved widely sought-after translation Bible English language . Now 400 year old , King James Version shaping Christians century majesty solemnity .",1
How to Be a 3% Man,Corey Wayne,4.7,2068.0,668.0,453.0,688,Family & Relationships,"Dear friend : This book teach hidden secret completely understand woman . How meet date type woman 've always wanted effortless relationship ! How get girlfriend . How date multiple woman . How get wife girlfriend back . Turn girl `` friend '' girlfriend . Live life dream accomplish goal . How get woman pursue approach first , etc .",1
On Earth We're Briefly Gorgeous,Ocean Vuong,4.5,1385.5,752.0,439.0,1,Contemporary Fiction (Books),"Random House present audiobook edition On Earth We 're Briefly Gorgeous , written read Ocean Vuong .",3
Naina (Hindi Edition),Sanjeev Paliwal,4.15,51.5,836.0,657.0,197,"Crime, Thriller & Mystery (Books)","India ’ favourite news anchor , Naina Vashisht murdered le 500 metre home go jog neighbourhood park . As glamourous ambitious , name reckon medium political circle , crucial TRP channel .",1
"Killing Floor: Jack Reacher, Book 1",Lee Child,4.4,10122.0,1093.0,939.0,812,Mysteries,"Brought Penguin , Killing Floor first instalment Lee Child ’ internationally popular Jack Reacher series , read Jeff Harding .",2
HBR’s 10 Must Reads on Emotional Intelligence,Harvard Business Review,4.6,215.5,668.0,329.0,639,esses,"In defining work emotional intelligence , best-selling author Daniel Goleman found twice important competency determining outstanding leadership . If listen nothing else emotional intelligence , listen 10 article expert field . We 've combed hundred article Harvard Business Review archive selected important one help boost emotional skill - professional success . This book inspire :",1
The Great Influenza: The Story of the Deadliest Pandemic in History,John M. Barry,4.6,2449.0,1093.0,1166.0,1,Biological Sciences,Brought Penguin .,2
Rowley Jefferson's Awesome Friendly Adventure,Jeff Kinney,4.7,231.5,410.0,91.0,1,Children's Fantasy (Books),Brought Puffin .,2
NLP: The Essential Guide to Neuro-Linguistic Programming,Tom Dotz,4.6,408.5,836.0,674.0,774,Personal Success,"NLP ( neuro-linguistic programming ) helped million overcome fear , increase confidence , achieve greater success personal professional life relationship . Now , company created NLP : The New Technology Achievement - one best-selling NLP book time - come NLP : The Essential Guide Neuro-Linguistic Programming .",0
The Ultimate Deepak Chopra Collection,Deepak Chopra MD,1.0,1.0,2008.0,1241.0,429,Religion & Spirituality (Books),Meet one power make difference life !,1
Mahabharata: The Greatest Spiritual Epic of All Time,Krishna Dharma,4.7,161.5,1003.0,2735.0,1,duism (Books),"By completing purchase agree Audible ’ Conditions Use , Amazon 's Privacy Notice applicable Audible 's Recurring Payment Terms .",4
"Coding Languages for Absolute Beginners: 6 Books in 1: Arduino, C++, C#, Powershell, Python & SQL",Zach Webber,4.4,30.0,668.0,459.0,823,g Language & Tool,"The world changing rapidly , technology center . Technology affecting present . Technology drive shape future . What better way part driving force learn beating heart computer application ? Coding .",1
"Manage Your Time, Master Your Life",Robin Sharma,5.0,1.0,515.0,45.0,1,Personal Development & Self-Help,"By completing purchase agree Audible ’ Conditions Use , Amazon 's Privacy Notice applicable Audible 's Recurring Payment Terms .",4
Five Point Someone: What Not To Do at IIT,Chetan Bhagat,-1.0,267.25,568.0,431.0,792,Literature & Fiction (Books),"Five reason Hary , Ryan Alok 's life complete mess :",1
Best Long Tales and Stories for Kids,div.,-1.0,267.25,414.0,262.0,608,Children's Traditional Stories (Books),"By completing purchase agree Audible ’ Conditions Use , Amazon 's Privacy Notice applicable Audible 's Recurring Payment Terms .",4
The Game,Neil Strauss,4.3,1606.5,797.0,567.0,927,Biographies & Autobiographies (Books),"The Game recount incredible adventure everyday man transforms shy , awkward writer quick-witted , smooth-talking Style , character irresistible woman . But life better could ever dreamed ( us technique Britney Spears , receives life coaching Tom Cruise , move mansion Courtney Love , officially voted World 's Number One Pickup Artist ) , fall head heel woman beat game .",1
The New Psycho-Cybernetics: A Mind Technology for Living Your Life Without Limits,Maxwell Maltz,-1.0,267.25,1439.0,371.0,358,"d, Body & Spirit",Tap power The New Psycho-Cybernetics .,0
"What's Your Problem: To Solve Your Toughest Problems, Change the Problems You Solve",Thomas Wedell-Wedellsborg,4.5,67.5,703.0,335.0,1,Leadership,Are solving right problem ?,1
The Autobiography of Benjamin Franklin (AmazonClassics Edition),Benjamin Franklin,4.3,2225.5,668.0,400.0,1,Revolution Histories,"Written 1717 1790 , originally referred author simply Memoirs , Benjamin Franklin ’ autobiography considered pioneering example genre . In influential account American Dream action , Franklin recount early life , invention , quest virtue self-improvement , political achievement . The unfinished work vivid depiction life early America , well relatable inspiring portrait one revolutionary thinker .",1
"13 Things Mentally Strong People Don't Do: Take Back Your Power, Embrace Change, Face Your Fears, and Train Your Brain for Happiness and Success",Amy Morin,4.6,1354.5,10378.0,396.0,1,Analysis & Strategy,"Everyone know regular exercise weight training lead physical strength . But strengthen mentally truly tough time ? And face challenge ? Or psychotherapist Amy Morin asks , avoid encounter adversity ? Through year counseling others experience navigating personal loss , Morin realized often habit break holding u back true success happiness . Indulging self-pity agonizing thing beyond control , obsessing past event , resenting achievement others , expecting immediate positive result hold u back .",1
"The House of Hades: Heroes of Olympus, Book 4",Rick Riordan,4.7,5892.5,888.0,1051.0,-1,",            5 star,          ,            ,              81%,            ,",The fourth book best-selling Heroes Olympus series - set explosive world Percy Jackson - available unabridged audio download .,0
What to Expect When You’re Expecting,Heidi Murkoff,4.6,5221.5,1673.0,1963.0,730,Relationships,"It ’ . Everything need know -- ’ wait find out—about amazing nine month , conception birth beyond world ’ best-selling best-loved pregnancy guide : Heidi Murkoff ’ What Expect When You ’ Expecting . And , Audible , ’ hear reassuring , relatable voice expectant parent turn must-have advice information crave trust .",1
Apne Bheetar Chhupe Leader ko Kaise Jagayein [Developing the Leader Within You],John C. Maxwell,4.6,54.0,668.0,531.0,521,Analysis & Strategy,"For many year , John C. Maxwell equipped inspired Christians attain highest level effective leadership conference book . Maxwell belief leadership determines organization 's growth . More specifically , empower people within group become leader . Designed small large group , audiobook everything necessary equip anyone want reproduce leader .",1
"Get S--t Done: The Ultimate Guide to Productivity, Procrastination, & Profitability",Jeffrey Gitomer,4.5,76.5,469.0,232.0,396,Personal Success,The must-have guide getting -- done !,0
"Born to Run: The Hidden Tribe, the Ultra-Runners, and the Greatest Race the World Has Never Seen",Christopher McDougall,4.7,5096.0,721.0,666.0,2,g (Books),"Full incredible character , amazing athletic achievement , cutting-edge science , , , pure inspiration , Born Run epic adventure began one simple question : Why foot hurt ?",1
"Diary of a Wimpy Kid: Diary of a Wimpy Kid, Book 1",Jeff Kinney,4.6,4431.5,410.0,139.0,1,Children's Literature & Fiction (Books),Brought Puffin .,2
Open: The Autobiography,Andre Agassi,4.7,2946.0,5709.0,388.0,-1,",            5 star,          ,            ,              77%,            ,",He one beloved athlete history one gifted men ever step onto tennis court - early childhood Andre Agassi hated game .,1
Pralay: The Great Deluge,Vineet Bajpai,4.4,586.5,668.0,495.0,2,"Crime, Thriller & Mystery (Books)",“ Even death afraid White Mask ”,1
"AI Superpowers: China, Silicon Valley, and the New World Order",Kai-Fu Lee,4.5,703.0,837.0,568.0,1,Textbooks & Study Guides,Here two well-known fact :,1
The Practicing Mind: Developing Focus and Discipline in Your Life,Thomas M. Sterner,4.5,525.5,350.0,231.0,872,Personal Development & Self-Help,"Present moment awareness essential ingredient life one expects experience degree authentic peace contentment . It acknowledged century cornerstone spiritual awakening tradition Eastern thought . In West , however , still relatively unrecognized concept living .",1
Outgrowing God: A Beginner’s Guide,Richard Dawkins,4.6,396.0,888.0,398.0,762,Ethics & Morality Philosophy,Random House present audio edition Outgrowing God Richard Dawkins .,3
Go Pro - 7 Steps to Becoming a Network Marketing Professional,Eric Worre,4.8,4418.5,233.0,169.0,375,ess Careers,"Over twenty year ago company convention , Eric Worre `` aha '' moment changed life forever . At event made decision Go Pro become Network Marketing expert . Since time , focused developing skill . In , Eric touched touched hundred thousand people around world . Now share wisdom guide ignite passion profession help make decision Go Pro create life dream .",1
The Graveyard Book,Neil Gaiman,4.6,3155.5,451.0,463.0,533,Audiobooks on Family Life for Children,"When baby escape murderer intent killing entire family , would thought would find safety security local graveyard ?",1
The Outsiders: Eight Unconventional CEOs and Their Radically Rational Blueprint for Success,William N. Thorndike,4.6,558.0,601.0,352.0,319,Analysis & Strategy,`` It impossible produce superior performance unless something different . '' - John Templeton .,1
What I Know for Sure,Oprah Winfrey,4.7,2164.0,323.0,233.0,1,Personal Success,"The inspirational wisdom Oprah Winfrey , collected first time beautiful book . After film critic Gene Siskel asked , 'What know sure ? ' Oprah Winfrey began writing 'What I Know For Sure ' column O , The Oprah Magazine . Saying question offered way take 'stock life ' , Oprah penned one column month last 14 year , year retired The Oprah Winfrey Show ( highest-rated program kind history ) , launched television network , became America 's black billionaire , awarded honorary degree Harvard University Presidential Medal Freedom , watched friend colleague come go , lost beloved pet adopted new one , celebrated milestone birthday . Throughout , 's continued offer profound inspiring word wisdom 'What I Know For Sure ' column O , The Oprah Magazine . Now , first time , thoughtful gem revised , updated , collected What I Know For Sure , beautiful book packed insight revelation Oprah Winfrey . Organized theme - joy , resilience , connection , gratitude , possibility , awe , clarity , power - essay offer rare powerful glimpse mind one world 's extraordinary woman . Candid , moving , exhilarating , uplifting , dynamic , word Oprah share What I Know For Sure shimmer sort wisdom truth listener turn .",1
The Law of Attraction: The Basics of the Teachings of Abraham,Esther Hicks,4.6,1757.0,562.0,360.0,1,Personal Development & Self-Help,"You 'll learn omnipresent law govern universe make work advantage . The knowledge 'll absorb listening Abraham 's wisdom take guesswork daily living . You 'll finally understand everything 's happening life , well life 're interacting , find joyously , , anything desire !",1
"Savarkar: Echoes of a Forgotton Past, Vol. 1: Part 2",Vikram Sampath,5.0,2.0,879.0,513.0,2,Biographies of Politicians,"As intellectual fountainhead ideology Hindutva , political ascendancy India today , Vinayak Damodar Savarkar undoubtedly one contentious political thinker leader 20th century .",1
Elantris,Brandon Sanderson,4.6,1830.5,990.0,1722.0,764,Fantasy (Books),"Elantris built magic , thrived . But magic began fade , Elantris began rot . Now shattered citizen face domination powerful Imperium . Can young Princess unite people Elantris lead rebellion imperial zealot ?",1
"Wake Up, Life Is Calling",Preeti Shenoy,4.5,1028.5,668.0,521.0,410,Romance (Books),"Ankita fought mental disorder , hell survived two suicide attempt . Now Mumbai , surrounded loving supportive parent , everything seems idyllic . She medication . She college love , studying dream subject : creative writing . She made friend bubbly Parul glamourous Janki . At last leading ‘ normal life ’ , immerses every bit - class , friend , course carefree fun college .",1
"Magnus Chase and the Sword of Summer: Magnus Chase and the Gods of Asgard, Book One",Rick Riordan,4.6,2747.0,1025.0,920.0,401,Literature & Fiction for Children,"Penguin present unabridged , downloadable audiobook edition Magnus Chase Sword Summer , Magnus Chase Gods Asgard book one , Rick Riordan , read Christopher Guetig .",3
"Medical Medium Cleanse to Heal: Healing Plans for Sufferers of Anxiety, Depression, Acne, Eczema, Lyme, Gut Problems, Brain Fog, Weight Issues, Migraines, Bloating, Vertigo, Psoriasis, Cysts, Fatigue, PCOS, Fibroids, UTI, Endometriosis & Autoimmune",Anthony William,4.7,2145.5,938.0,1674.0,1,g & Wellness,"If think n't need cleanse - 're sure could n't possibly harboring toxin body - think . In today 's world , poison pathogen threaten health starting 're even born , continue hold u back encounter everyday life .",1
The Iliad & the Odyssey,Homer,4.7,279.0,32.0,1469.0,1,Poetry (Books),"The Iliad : Join Achilles Gates Troy slays Hector Avenge death Patroclus . Here story love war , hope despair , honor glory . The recent major motion picture Helen Troy starring Brad Pitt prof epic relevant today twenty five hundred year ago first written . So journey back Trojan War Homer relive grandest adventure time .",0
The Consolations of Philosophy,Alain de Botton,4.6,332.5,468.0,401.0,2,Consciousness & Thought,"In ancient Greece Rome , philosopher seen natural authority pressing question . However , since , idea finding wisdom philosophy come seem bizarre . Enter university department today ask study wisdom , politely firmly shown door . The Consolations Philosophy set refute notion good philosophy must irrelevant gather together six great philosopher convinced power philosophical insight work practical effect life .",1
Harappa: Curse of the Blood River,Vineet Bajpai,4.1,997.0,668.0,474.0,775,Fairy Tale Fantasy,"2017 , Delhi - Vidyut ’ dying ancestor summons Banaras . The old Brahmin chieftain Dev-Raakshasa Matth , God-Demon Clan , bear chilling secret . Their bloodline carry ancient curse plague mankind - towards violent extinction .",0
Alchemy: The Surprising Power of Ideas That Don't Make Sense,Rory Sutherland,4.6,255.0,683.0,578.0,658,Analysis & Strategy,"Random House present audiobook edition Alchemy : The Surprising Power Ideas That Do n't Make Sense , written Rory Sutherland .",3
Night Train at Deoli (Hindi Edition),Ruskin Bond,4.4,17.0,668.0,403.0,2,Short Stories (Books),"Night Train Deoli collection story , set valley Uttarakhand , place author grew . The story revolve around life simple folk live serene life away hustle bustle city . These simple heartwarming story sure hit chord bring smile face listener .",0
Silence: The Power of Quiet in a World Full of Noise,Thich Nhat Hanh,4.7,367.0,615.0,199.0,2,Religion & Spirituality (Books),"We spend lot time looking happiness world right around u full wonder . But heart mind full noise ca n't always hear call life love . To hear call respond , need silence .",1
Living from a Place of Surrender: The Untethered Soul in Action,Michael A. Singer,4.0,2.0,820.0,556.0,455,"d, Body & Spirit",A program change entire perspective life,1
"The Mark of Athena: Heroes of Olympus, Book 3",Rick Riordan,4.7,5181.0,888.0,908.0,-1,",            5 star,          ,            ,              80%,            ,",The explosive third part Rick Riordan 's number-one series - set world Percy Jackson - available unabridged audio download . One fatal prophecy . Seven brave demigod . A quest find - close - door death .,0
Phantoms in the Brain: Probing the Mysteries of the Human Mind,V.S. Ramachandran,4.6,239.5,1055.0,647.0,820,Physical Illness & Disease,"Neuroscientist V. S. Ramachandran internationally renowned uncovering answer deep quirky question human nature scientist dared address . His bold insight brain matched stunning simplicity experiment - using low-tech tool cotton swab , glass water , dime-store mirror .",1
Love in the Time of Cholera,Gabriel García Márquez,4.3,1419.0,952.0,941.0,1,Literary Fiction,"Audie Award Finalist , Classic , 2014",1
World War Z,Max Brooks,4.4,6078.5,721.0,836.0,2,Horror (Books),"Visceral , disturbing chilling realism , World War Z perhaps famous work world 's foremost expert undead counterpart . Paired equally gripping The Zombie Survival Guide , better preparation inevitable uprising .",1
My Hanuman Chalisa,Devdutt Pattnaik,4.5,409.0,501.0,279.0,1,duism (Books),Reflecting one Hinduism ’ popular prayer positive energy,1
Permanent Record,Edward Snowden,4.6,4919.0,323.0,691.0,191,Privacy & Surveillance Studies,"Edward Snowden , man risked everything expose US government ’ system mass surveillance , reveals first time story life , including helped build system motivated try bring .",1
Critical Chain: Project Management and the Theory of Constraints,Eliyahu M. Goldratt,4.6,3.0,820.0,447.0,1,Textbooks & Study Guides,"A young , untested team problem solver challenged saving company move board room classroom search answer - find lively , open discourse innovative professor . This gripping , fast-paced business novel project management Eliyahu M. Goldratt 's novel done production marketing .",1
Essential Meditations with Eckhart Tolle: Guided Sessions and Practical Teachings,Eckhart Tolle,5.0,3.0,1149.0,458.0,2,"d, Body & Spirit",Discover timeless Presence beyond thought collection meditation Eckhart Tolle,1
"Angry God: All Saints High, Book 3",L.J. Shen,4.7,516.0,836.0,685.0,1,Romance (Books),"Vaughn Spencer . They call angry god . To , nothing heartless prince .",1
Feel Better In 5: Your Daily Plan to Supercharge Your Health,Dr Rangan Chatterjee,4.6,1064.5,888.0,321.0,2,g & Wellness,Brought Penguin .,2
Million Dollar Habits: 12 Power Practices to Double and Triple Your Income,Brian Tracy,3.8,5.0,1774.0,426.0,1,ance,Accelerate income ... almost overnight !,1
Business Sutra: A Very Indian Approach to Management,Devdutt Pattanaik,4.5,205.0,836.0,686.0,2,Analysis & Strategy,"In landmark book , best-selling author , leadership coach mythologist Devdutt Pattanaik show , despite veneer objectivity , modern management rooted Western belief obsessed accomplishing rigid objective increasing shareholder value . By contrast , Indian way business , apparent Indian mythology , longer seen practice , accommodates subjectivity diversity offer inclusive , empathetic way achieving success . Great value placed darshan - , see world relationship Lakshmi , goddess wealth .",1
Geronimo Stilton #25: The Search for Sunken Treasure & #26: The Mummy with No Name,Geronimo Stilton,-1.0,267.25,469.0,139.0,-1,",          5 star,        ,          (0%),        ,          ,            0%,          ,","# 25 : The Search Sunken Treasure `` Holey cheese , adventure ! I Ratlápagos Islands family search longlost buried treasure . But oh , I hate traveling ! Being ship middle sea n't idea 'fabumouse ' time . And I beginning suspect n't one searching treasure .... ''",1
Sense and Sensibility,Jane Austen,4.4,2768.5,836.0,685.0,427,Classic Literature,"In Audible Exclusive production , Academy Award nominee Rosamund Pike ( Gone Girl ) narrates one Jane Austen ’ beloved work , Sense Sensibility . In timeless tale misguided romance heartbreak , two teenage heroine must overcome pitfall Georgian England ’ high society order achieve love happiness seek . The admiration Pike Austen ’ work shown clearly passionate delivery Austen ’ first published novel .",0
Black Friday: The True Story of the Bombay Bomb Blasts,Hussain Zaidi,4.5,96.0,879.0,543.0,2,United States Politics & Government,"Black Friday S Hussain Zaidi ghastly account one biggest terrorist attack Bombay , 1993 . The book chronicle devastation caused life property due attack trauma , physical mental , undergone people large post terrorist attack consequent rift community Hindu Muslims hatred clash often turned extremely violent .",0
"Enlightenment Now: The Case for Reason, Science, Humanism, and Progress",Steven Pinker,4.5,1463.0,1093.0,1189.0,463,Philosophy Movements,"Penguin present audiobook edition Enlightenment Now Steven Pinker , read Arthur Morey . Includes bonus PDF graph .",3
Competing in the Age of AI: Strategy and Leadership When Algorithms and Networks Run the World,Marco Iansiti,4.7,98.5,586.0,578.0,1,istration,"In industry industry , data , analytics , AI-driven process transforming nature work . While often still treat AI domain specific skill , business function , sector , entered new era AI challenging concept firm . AI-centric organization exhibit new operating architecture , redefining create , capture , share , deliver value .",1
The Second Sex,Simone de Beauvoir,4.5,422.0,1884.0,2349.0,2,Textbooks & Study Guides,Unabridged available audio first time,0
Naraz [Angry],Rahat Indori,4.5,262.5,233.0,98.0,2,Poetry (Books),"Naraz many reference reflect resenting virtue Rahat Indori . A lyricist film par excellence , master literature college , famous poet loved - also accomplishes playing colour line . Besides trait , also able discern inner outer dilemma people political social backdrop .",1
Looking for Alaska,John Green,4.4,7099.0,1005.0,400.0,2,g for Teens,Now Hulu Limited Series !,1
"Technical Analysis for Dummies, 3rd Edition",Barbara Rockefeller,-1.0,267.25,703.0,695.0,2,Analysis & Strategy,"A simple , straightforward guide fundamental technical analysis .",1
